{
  "schema_version": "0.1.0",
  "status": "approved",
  "approval_id": "approval_demo_001",
  "run_id": "run_demo_001",
  "iteration": 0,
  "scenarios_sha256": "809ec9881f25746fbf714209d56a820a2724ee48ce52835db8dde3dddbd76e69",
  "policy_id": "abc2lab-fixture-policy",
  "policy_version": "0.1.0",
  "approved_scenario_ids": ["scenario_update_order_001"],
  "approved_by": "operator_demo_001",
  "approved_at": "2026-01-01T00:00:00Z",
  "expires_at": "2099-01-01T00:00:00Z"
}
